{
  "package_format": "research-core-package",
  "package_id": "6f7a8b9c-0d1e-4f2a-8b3c-4d5e6f7a8b9c",
  "project_id": "0b8f3c3e-6f0e-4d5e-9c43-5b1f7a0f2a11",
  "exported_at": "2026-09-24T12:00:00Z",
  "exported_by": {"kind": "HUMAN", "id": "local-owner", "role": "RESEARCHER"},
  "producer": {"product": "PRODUCT_B", "version": "0.1.0"},
  "versions": {"core_schema_version": "1.0.0", "methodology_version": "1.0.0", "constitution_version": "1.0.0"},
  "entries": [
    {"path": "entities/projects.json", "sha256": "e3b0c44298fc1c149afbf4c8996fb92427ae41e4649b934ca495991b7852b855", "content_type": "entities", "entity_type": "Project"}
  ],
  "excluded_assets": [
    {"asset_id": "9a8b7c6d-5e4f-4a3b-9c2d-1e0f9a8b7c6d", "reason": "License does not permit redistribution."}
  ]
}
